{
  "task_id": "WIS-REV-001",
  "objective": "Auditar la base provisional de distribuidoras y entregar el primer lote validado de 25 empresas medianas o chicas.",
  "owner": "growth-research",
  "priority": "P0",
  "status": "BACKLOG",
  "dependencies": [],
  "source_threads": ["01a011c6-ec79-7d32-b706-b4b73f9abdcb"],
  "inputs": ["Planilla comercial WIS", "criterios actuales de tamaño, contactos y reseñas"],
  "expected_outputs": ["Auditoría de filas provisionales", "Lote de 25 filas listo para QA"],
  "write_scope": ["Filas asignadas del lote en las columnas comerciales existentes", "Registro de evidencia en Runs"],
  "approval_required": false,
  "approval_actions": [],
  "acceptance_tests": ["Sin duplicados", "Sin corporaciones grandes", "Contacto corporativo verificable", "Sólo reseñas 1-3 con analizadas/total accesible"]
}

